"D-ORAM: Path-ORAM Delegation for Low Execution Interference on Cloud Servers with Untrusted Memory","R. Wang; Y. Zhang; J. Yang","Electr. & Comput. Eng. Dept., Univ. of Pittsburgh, Pittsburgh, PA, USA; Comput. Sci. Dept., Univ. of Pittsburgh, Pittsburgh, PA, USA; Electr. & Comput. Eng. Dept., Univ. of Pittsburgh, Pittsburgh, PA, USA",2018 IEEE International Symposium on High Performance Computer Architecture (HPCA),"29 Mar 2018","2018","","","416","427","Cloud computing has evolved into a promising computing paradigm. However, it remains a challenging task to protect application privacy and, in particular, the memory access patterns, on cloud servers. The Path ORAM protocol achieves high-level privacy protection but requires large memory bandwidth, which introduces severe execution interference. The recently proposed secure memory model greatly reduces the security enhancement overhead but demands the secure integration of cryptographic logic and memory devices, a memory architecture that is yet to prevail in mainstream cloud servers. In this paper, we propose D-ORAM, a novel Path ORAM scheme for achieving high-level privacy protection and low execution interference on cloud servers with untrusted memory. D-ORAM leverages the buffer-on-board (BOB) memory architecture to offload the Path ORAM primitives to a secure engine in the BOB unit, which greatly alleviates the contention for the off-chip memory bus between secure and non-secure applications. D-ORAM upgrades only one secure memory channel and employs Path ORAM tree split to extend the secure application flexibly across multiple channels, in particular, the non-secure channels. D-ORAM optimizes the link utilization to further improve the system performance. Our evaluation shows that D-ORAM effectively protects application privacy on mainstream computing servers with untrusted memory, with an improvement of NS-App performance by 22.5% on average over the Path ORAM baseline.","2378-203X","978-1-5386-3659-6","10.1109/HPCA.2018.00043","","https://ieeexplore.ieee.org/stamp/stamp.jsp?arnumber=8327026","ORAM;hardware security;server;memory system","Servers;Cryptography;Memory architecture;Interference;Memory management","","23","","48","IEEE","29 Mar 2018","","","IEEE","IEEE Conferences"
"Secure DIMM: Moving ORAM Primitives Closer to Memory","A. Shafiee; R. Balasubramonian; M. Tiwari; F. Li","School of Computing, University of Utah, Salt Lake City, Utah, USA; School of Computing, University of Utah, Salt Lake City, Utah, USA; School of Computing, University of Utah, Salt Lake City, Utah, USA; Dept. of ECE, University of Texas Austin, Austin, Texas, USA",2018 IEEE International Symposium on High Performance Computer Architecture (HPCA),"29 Mar 2018","2018","","","428","440","As more critical applications move to the cloud, there is a pressing need to provide privacy guarantees for data and computation. While cloud infrastructures are vulnerable to a variety of attacks, in this work, we focus on an attack model where an untrusted cloud operator has physical access to the server and can monitor the signals emerging from the processor socket. Even if data packets are encrypted, the sequence of addresses touched by the program serves as an information side channel. To eliminate this side channel, Oblivious RAM constructs have been investigated for decades, but continue to pose large overheads. In this work, we make the case that ORAM overheads can be significantly reduced by moving some ORAM functionality into the memory system. We first design a secure DIMM (or SDIMM) that uses commodity low-cost memory and an ASIC as a secure buffer chip. We then design two new ORAM protocols that leverage SDIMMs to reduce bandwidth, latency, and energy per ORAM access. In both protocols, each SDIMM is responsible for part of the ORAM tree. Each SDIMM performs a number of ORAM operations that are not visible to the main memory channel. By having many SDIMMs in the system, we are able to achieve highly parallel ORAM operations. The main memory channel uses its bandwidth primarily to service blocks requested by the CPU, and to perform a small subset of the many shuffle operations required by conventional ORAM. The new protocols guarantee the same obliviousness properties as Path ORAM. On a set of memory-intensive workloads, our two new ORAM protocols – Independent ORAM and Split ORAM – are able to improve performance by 1.9x and energy by 2.55x, compared to Freecursive ORAM.","2378-203X","978-1-5386-3659-6","10.1109/HPCA.2018.00044","","https://ieeexplore.ieee.org/stamp/stamp.jsp?arnumber=8327027","Privacy;Oblivious RAM;Memory Systems","Bandwidth;Protocols;Servers;Memory management;Parallel processing;DRAM chips","","23","","37","IEEE","29 Mar 2018","","","IEEE","IEEE Conferences"
"Comprehensive VM Protection Against Untrusted Hypervisor Through Retrofitted AMD Memory Encryption","Y. Wu; Y. Liu; R. Liu; H. Chen; B. Zang; H. Guan","Institute of Parallel and Distributed Systems-Shanghai, Jiao Tong University; Institute of Parallel and Distributed Systems-Shanghai, Jiao Tong University; Institute of Parallel and Distributed Systems-Shanghai, Jiao Tong University; Institute of Parallel and Distributed Systems-Shanghai, Jiao Tong University; Institute of Parallel and Distributed Systems-Shanghai, Jiao Tong University; Institute of Parallel and Distributed Systems-Shanghai, Jiao Tong University",2018 IEEE International Symposium on High Performance Computer Architecture (HPCA),"29 Mar 2018","2018","","","441","453","The confidentiality of tenant's data is confronted with high risk when facing hardware attacks and privileged malicious software. Hardware-based memory encryption is one of the promising means to provide strong guarantees of data security. Recently AMD has proposed its new memory encryption hardware called SME and SEV, which can selectively encrypt memory regions in a fine-grained manner, e.g., by setting the C-bits in the page table entries. More importantly, SEV further supports encrypted virtual machines. This, intuitively, has provided a new opportunity to protect data confidentiality in guest VMs against an untrusted hypervisor in the cloud environment. In this paper, we first provide a security analysis on the (in)security of SEV and uncover a set of security issues of using SEV as a means to defend against an untrusted hypervisor. Based on the study, we then propose a software-based extension to the SEV feature, namely Fidelius, to address those issues while retaining performance efficiency. Fidelius separates the management of critical resources from service provisioning and revokes the permissions of accessing specific resources from the un-trusted hypervisor. By adopting a sibling-based protection mechanism with non-bypassable memory isolation, Fidelius embraces both security and efficiency, as it introduces no new layer of abstraction. Meanwhile, Fidelius reuses the SEV API to provide a full VM life-cycle protection, including two sets of para-virtualized I/O interfaces to encode the I/O data, which is not considered in the SEV hardware design. A detailed and quantitative security analysis shows its effectiveness in protecting tenant's data from a variety of attack surfaces, and the performance evaluation confirms the performance efficiency of Fidelius.","2378-203X","978-1-5386-3659-6","10.1109/HPCA.2018.00045","","https://ieeexplore.ieee.org/stamp/stamp.jsp?arnumber=8327028","VM protection;Untrusted hypervisor;Memory encryption","Virtual machine monitors;Encryption;Hardware;Virtualization;Memory management","","13","","43","IEEE","29 Mar 2018","","","IEEE","IEEE Conferences"
"SYNERGY: Rethinking Secure-Memory Design for Error-Correcting Memories","G. Saileshwar; P. J. Nair; P. Ramrakhyani; W. Elsasser; M. K. Qureshi",NA; IBM Research; ARM Research; ARM Research; Georgia Institute of Technology,2018 IEEE International Symposium on High Performance Computer Architecture (HPCA),"29 Mar 2018","2018","","","454","465","Building trusted data-centers requires resilient memories which are protected from both adversarial attacks and errors. Unfortunately, the state-of-the-art memory security solutions incur considerable performance overheads due to accesses for security metadata like Message Authentication Codes (MACs). At the same time, commercial secure memory solutions tend to be designed oblivious to the presence of memory reliability mechanisms (such as ECC-DIMMs), that provide tolerance to memory errors. Fortunately, ECC-DIMMs possess an additional chip for providing error correction codes (ECC), that is accessed in parallel with data, which can be harnessed for security optimizations. If we can re-purpose the ECC-chip to store some metadata useful for security and reliability, it can prove beneficial to both. To this end, this paper proposes Synergy, a reliability-security co-design that improves performance of secure execution while providing strong reliability for systems with 9-chip ECC-DIMMs. Synergy uses the insight that MACs being capable of detecting data tampering are also useful for detecting memory errors. Therefore, MACs are best suited for being placed inside the ECC chip, to be accessed in parallel with each data access. By co-locating MAC and Data, Synergy is able to avoid a separate memory access for MAC and thereby reduce the overall memory traffic for secure memory systems. Furthermore, Synergy is able to tolerate 1 chip failure out of 9 chips by using a parity that is constructed over 9 chips (8 Data and 1 MAC), which is used for reconstructing the data of the failed chip. For memory intensive workloads, Synergy provides a speedup of 20% and reduces system Energy Delay Product by 31% compared to a secure memory baseline with ECC-DIMMs. At the same time, Synergy increases reliability by 185x compared to ECC-DIMMs that provide Single-Error Correction, Double-Error Detection (SECDED) capability. Synergy uses commercial ECC-DIMMs and does not incur any additional hardware overheads or reduction of security.","2378-203X","978-1-5386-3659-6","10.1109/HPCA.2018.00046","","https://ieeexplore.ieee.org/stamp/stamp.jsp?arnumber=8327029","Memory-Security;Reliability;ECC-DIMM","Encryption;Metadata;Memory management;Reliability engineering;Error correction codes","","63","1","59","IEEE","29 Mar 2018","","","IEEE","IEEE Conferences"
"A Case for Packageless Processors","S. Pal; D. Petrisko; A. A. Bajwa; P. Gupta; S. S. Iyer; R. Kumar","Department of Electrical and Computer Engineering, University of California, Los Angeles; Department of Electrical and Computer Engineering, University of Illinois at Urbana-Champaign; Department of Electrical and Computer Engineering, University of California, Los Angeles; Department of Electrical and Computer Engineering, University of California, Los Angeles; Department of Electrical and Computer Engineering, University of California, Los Angeles; Department of Electrical and Computer Engineering, University of Illinois at Urbana-Champaign",2018 IEEE International Symposium on High Performance Computer Architecture (HPCA),"29 Mar 2018","2018","","","466","479","Demand for increasing performance is far outpacing the capability of traditional methods for performance scaling. Disruptive solutions are needed to advance beyond incremental improvements. Traditionally, processors reside inside packages to enable PCB-based integration. We argue that packages reduce the potential memory bandwidth of a processor by at least one order of magnitude, allowable thermal design power (TDP) by up to 70%, and area efficiency by a factor of 5 to 18. Further, silicon chips have scaled well while packages have not. We propose packageless processors - processors where packages have been removed and dies directly mounted on a silicon board using a novel integration technology, Silicon Interconnection Fabric (Si-IF). We show that Si-IF-based packageless processors outperform their packaged counterparts by up to 58% (16% average), 136%(103% average), and 295% (80% average) due to increased memory bandwidth, increased allowable TDP, and reduced area respectively. We also extend the concept of packageless processing to the entire processor and memory system, where the area footprint reduction was up to 76%.","2378-203X","978-1-5386-3659-6","10.1109/HPCA.2018.00047","","https://ieeexplore.ieee.org/stamp/stamp.jsp?arnumber=8327030","Packageless Processors;Silicon Interconnect Fabric","Program processors;Silicon;Bandwidth;Thermal resistance;Pins;Heat sinks","","22","1","76","IEEE","29 Mar 2018","","","IEEE","IEEE Conferences"
"Extending the Power-Efficiency and Performance of Photonic Interconnects for Heterogeneous Multicores with Machine Learning","S. Van Winkle; A. K. Kodi; R. Bunescu; A. Louri","School of Electrical Engineering and Computer Science, Ohio University, Athens, Ohio; School of Electrical Engineering and Computer Science, Ohio University, Athens, Ohio; School of Electrical Engineering and Computer Science, Ohio University, Athens, Ohio; Department of Electrical and Computer Engineering, George Washington University, Washington DC",2018 IEEE International Symposium on High Performance Computer Architecture (HPCA),"29 Mar 2018","2018","","","480","491","As communication energy exceeds computation energy in future technologies, traditional on-chip electrical interconnects face fundamental challenges in the many-core era. Photonic interconnects have been proposed as a disruptive technology solution due to superior performance per Watt, distance independent energy consumption and CMOS compatibility for on-chip interconnects. Static power due to the laser being always switched on, varying link utilization due to spatial and temporal traffic fluctuations and thermal sensitivity are some of the critical challenges facing photonics interconnects. In this paper, we propose photonic interconnects for heterogeneous multicores using a checkerboard pattern that clusters CPU-GPU cores together and implements bandwidth reconfiguration using local router information without global coordination. To reduce the static power, we also propose a dynamic laser scaling technique that predicts the power level for the next epoch using the buffer occupancy of previous epoch. To further improve power-performance trade-offs, we also propose a regression-based machine learning technique for scaling the power of the photonic link. Our simulation results demonstrate a 34% performance improvement over a baseline electrical CMESH while consuming 25% less energy per bit when dynamically reallocating bandwidth. When dynamically scaling laser power, our buffer-based reactive and ML-based proactive prediction techniques show 40 - 65% in power savings with 0 - 14% in throughput loss depending on the reservation window size.","2378-203X","978-1-5386-3659-6","10.1109/HPCA.2018.00048","","https://ieeexplore.ieee.org/stamp/stamp.jsp?arnumber=8327031","Network on Chips;Photonics;Power Scaling;Machine Learning","Photonics;Power lasers;Bandwidth;Multicore processing;System-on-chip;Graphics processing units","","16","","58","IEEE","29 Mar 2018","","","IEEE","IEEE Conferences"
"Routerless Network-on-Chip","F. Alazemi; A. AziziMazreah; B. Bose; L. Chen","Oregon State University, USA; Oregon State University, USA; Oregon State University, USA; Oregon State University, USA",2018 IEEE International Symposium on High Performance Computer Architecture (HPCA),"29 Mar 2018","2018","","","492","503","Traditional bus-based interconnects are simple and easy to implement, but the scalability is greatly limited. While router-based networks-on-chip (NoCs) offer superior scalability, they also incur significant power and area overhead due to complex router structures. In this paper, we explore a new class of on-chip networks, referred to as Routerless NoCs, where routers are completely eliminated. We propose a novel design that utilizes on-chip wiring resources smartly to achieve comparable hop count and scalability as router-based NoCs. Several effective techniques are also proposed that significantly reduce the resource requirement to avoid new network abnormalities in routerless NoC designs. Evaluation results show that, compared with a conventional mesh, the proposed routerless NoC achieves 9.5X reduction in power, 7.2X reduction in area, 2.5X reduction in zero-load packet latency, and 1.7X increase in throughput. Compared with a state-of-the-art low-cost NoC design, the proposed approach achieves 7.7X reduction in power, 3.3X reduction in area, 1.3X reduction in zero-load packet latency, and 1.6X increase in throughput.","2378-203X","978-1-5386-3659-6","10.1109/HPCA.2018.00049","","https://ieeexplore.ieee.org/stamp/stamp.jsp?arnumber=8327032","Network on Chip;topology;CMP","Wiring;System-on-chip;Switches;Scalability;Throughput;Wires;Program processors","","40","","39","IEEE","29 Mar 2018","","","IEEE","IEEE Conferences"
"HeatWatch: Improving 3D NAND Flash Memory Device Reliability by Exploiting Self-Recovery and Temperature Awareness","Y. Luo; S. Ghose; Y. Cai; E. F. Haratsch; O. Mutlu",Carnegie Mellon University; Carnegie Mellon University; Carnegie Mellon University; Seagate Technology; Carnegie Mellon University,2018 IEEE International Symposium on High Performance Computer Architecture (HPCA),"29 Mar 2018","2018","","","504","517","NAND flash memory density continues to scale to keep up with the increasing storage demands of data-intensive applications. Unfortunately, as a result of this scaling, the lifetime of NAND flash memory has been decreasing. Each cell in NAND flash memory can endure only a limited number of writes, due to the damage caused by each program and erase operation on the cell. This damage can be partially repaired on its own during the idle time between program or erase operations (known as the dwell time), via a phenomenon known as the self-recovery effect. Prior works study the self-recovery effect for planar (i.e., 2D) NAND flash memory, and propose to exploit it to improve flash lifetime, by applying high temperature to accelerate self-recovery. However, these findings may not be directly applicable to 3D NAND flash memory, due to significant changes in the design and manufacturing process that are required to enable practical 3D stacking for NAND flash memory. In this paper, we perform the first detailed experimental characterization of the effects of self-recovery and temperature on real, state-of-the-art 3D NAND flash memory devices. We show that these effects influence two major factors of NAND flash memory reliability: (1) retention loss speed (i.e., the speed at which a flash cell leaks charge), and (2) program variation (i.e., the difference in programming speed across flash cells). We find that self-recovery and temperature affect 3D NAND flash memory quite differently than they affect planar NAND flash memory, rendering prior models of self-recovery and temperature ineffective for 3D NAND flash memory. Using our characterization results, we develop a new model for 3D NAND flash memory reliability, which predicts how retention, wearout, self-recovery, and temperature affect raw bit error rates and cell threshold voltages. We show that our model is accurate, with an error of only 4.9%. Based on our experimental findings and our model, we propose HeatWatch, a new mechanism to improve 3D NAND flash memory reliability. The key idea of HeatWatch is to optimize the read reference voltage, i.e., the voltage applied to the cell during a read operation, by adapting it to the dwell time of the workload and the current operating temperature. HeatWatch (1) efficiently tracks flash memory temperature and dwell time online, (2) sends this information to our reliability model to predict the current voltages of flash cells, and (3) predicts the optimal read reference voltage based on the current cell voltages. Our detailed experimental evaluations show that HeatWatch improves flash lifetime by 3.85× over a baseline that uses a fixed read reference voltage, averaged across 28 real storage workload traces, and comes within 0.9% of the lifetime of an ideal read reference voltage selection mechanism.","2378-203X","978-1-5386-3659-6","10.1109/HPCA.2018.00050","","https://ieeexplore.ieee.org/stamp/stamp.jsp?arnumber=8327033","","Flash memories;Three-dimensional displays;Threshold voltage;Heating systems;Reliability;Transistors;Solid modeling","","84","","67","IEEE","29 Mar 2018","","","IEEE","IEEE Conferences"
"RC-NVM: Enabling Symmetric Row and Column Memory Accesses for In-memory Databases","P. Wang; S. Li; G. Sun; X. Wang; Y. Chen; H. Li; J. Cong; N. Xiao; T. Zhang","Center for Energy-efficient Computing and Applications, Peking University, China; State Key Laboratory of High Performance Computing, National University of Defense Technology, China; Center for Energy-efficient Computing and Applications, Peking University, China; Center for Energy-efficient Computing and Applications, Peking University, China; Department of Electrical and Computer Engineering, Duke University, USA; Department of Electrical and Computer Engineering, Duke University, USA; University of California, Los Angeles, USA; State Key Laboratory of High Performance Computing, National University of Defense Technology, China; Pennsylvania State University, USA",2018 IEEE International Symposium on High Performance Computer Architecture (HPCA),"29 Mar 2018","2018","","","518","530","Ever increasing DRAM capacity has fostered the development of in-memory databases (IMDB). The massive performance improvements provided by IMDBs have enabled transactions and analytics on the same database. In other words, the integration of OLTP (on-line transactional processing) and OLAP (on-line analytical processing) systems is becoming a general trend. However, conventional DRAM-based main memory is optimized for row-oriented accesses generated by OLTP workloads in row-based databases. OLAP queries scanning on specified columns cause so-called strided accesses and result in poor memory performance. Since memory access latency dominates in IMDB processing time, it can degrade overall performance significantly. To overcome this problem, we propose a dual-addressable memory architecture based on non-volatile memory, called RC-NVM, to support both row-oriented and column-oriented accesses. We first present circuit-level analysis to prove that such a dual-addressable architecture is only practical with RC-NVM rather than DRAM technology. Then, we rethink the addressing schemes, data layouts, cache synonym, and coherence issues of RC-NVM in architectural level to make it applicable for IMDBs. Finally, we propose a group caching technique that combines the IMDB knowledge with the memory architecture to further optimize the system. Experimental results show that the memory access performance can be improved up to 14.5X with only 15% area overhead.","2378-203X","978-1-5386-3659-6","10.1109/HPCA.2018.00051","","https://ieeexplore.ieee.org/stamp/stamp.jsp?arnumber=8327034","Non volatitle Memory;In Memory Database;OLTP;OLAP","Random access memory;Databases;Layout;Nonvolatile memory;Memory architecture;Decoding","","17","","51","IEEE","29 Mar 2018","","","IEEE","IEEE Conferences"
