"Wait of a Decade: Did SPEC CPU 2017 Broaden the Performance Horizon?","R. Panda; S. Song; J. Dean; L. K. John",equivalent contribution to this work; equivalent contribution to this work; The University of Texas at Austin; The University of Texas at Austin,2018 IEEE International Symposium on High Performance Computer Architecture (HPCA),"29 Mar 2018","2018","","","271","282","The recently released SPEC CPU2017 benchmark suite has already started receiving a lot of attention from both industry and academic communities. However, due to the significantly high size and complexity of the benchmarks, simulating all the CPU2017 benchmarks for design trade-off evaluation is likely to become extremely difficult. Simulating a randomly selected subset, or a random input set, may result in misleading conclusions. This paper analyzes the SPEC CPU2017 benchmarks using performance counter based experimentation from seven commercial systems, and uses statistical techniques such as principal component analysis and clustering to identify similarities among benchmarks. Such analysis can reveal benchmark redundancies and identify subsets for researchers who cannot use all benchmarks in pre-silicon design trade-off evaluations. Many of the SPEC CPU2006 benchmarks have been replaced with larger and complex workloads in the SPEC CPU2017 suite. However, compared to CPU2006, it is unknown whether SPEC CPU2017 benchmarks have different performance demands or whether they stress machines differently. Additionally, to evaluate the balance of CPU2017 benchmarks, we analyze the performance characteristics of CPU2017 workloads and compare them with emerging database, graph analytics and electronic design automation (EDA) workloads. This paper provides the first detailed analysis of SPEC CPU2017 benchmark suite for the architecture community.","2378-203X","978-1-5386-3659-6","10.1109/HPCA.2018.00032","","https://ieeexplore.ieee.org/stamp/stamp.jsp?arnumber=8327015","Performance Evaluation;SPEC CPU2017;Benchmark Redundancy Analysis","Benchmark testing;C++ languages;Measurement;Industries;Principal component analysis;Redundancy;Stress","","73","","42","IEEE","29 Mar 2018","","","IEEE","IEEE Conferences"
"Architectural Support for Task Dependence Management with Flexible Software Scheduling","E. Castillo; L. Alvarez; M. Moreto; M. Casas; E. Vallejo; J. L. Bosque; R. Beivide; M. Valero",Universidad Politecnica de Catalunya; Universidad Politecnica de Catalunya; NA; Universidad Politecnica de Catalunya; Universidad de Cantabria; Universidad de Cantabria; Universidad de Cantabria; Universidad Politecnica de Catalunya,2018 IEEE International Symposium on High Performance Computer Architecture (HPCA),"29 Mar 2018","2018","","","283","295","The growing complexity of multi-core architectures has motivated a wide range of software mechanisms to improve the orchestration of parallel executions. Task parallelism has become a very attractive approach thanks to its programmability, portability and potential for optimizations. However, with the expected increase in core counts, finer-grained tasking will be required to exploit the available parallelism, which will increase the overheads introduced by the runtime system. This work presents Task Dependence Manager (TDM), a hardware/software co-designed mechanism to mitigate runtime system overheads. TDM introduces a hardware unit, denoted Dependence Management Unit (DMU), and minimal ISA extensions that allow the runtime system to offload costly dependence tracking operations to the DMU and to still perform task scheduling in software. With lower hardware cost, TDM outperforms hardware-based solutions and enhances the flexibility, adaptability and composability of the system. Results show that TDM improves performance by 12.3% and reduces EDP by 20.4% on average with respect to a software runtime system. Compared to a runtime system fully implemented in hardware, TDM achieves an average speedup of 4.2% with 7.3x less area requirements and significant EDP reductions. In addition, five different software schedulers are evaluated with TDM, illustrating its flexibility and performance gains.","2378-203X","978-1-5386-3659-6","10.1109/HPCA.2018.00033","","https://ieeexplore.ieee.org/stamp/stamp.jsp?arnumber=8327016","fine grain;dataflow;task based programming models;task dynamic dependences","Task analysis;Runtime;Software;Time division multiplexing;Hardware;Programming;Benchmark testing","","13","","43","IEEE","29 Mar 2018","","","IEEE","IEEE Conferences"
"GDP: Using Dataflow Properties to Accurately Estimate Interference-Free Performance at Runtime","M. Jahre; L. Eeckhout","Department of Computer Science, Norwegian University of Science and Technology (NTNU); Department of Electronics and Information Systems, Ghent University",2018 IEEE International Symposium on High Performance Computer Architecture (HPCA),"29 Mar 2018","2018","","","296","309","Multi-core memory systems commonly share resources between processors. Resource sharing improves utilization at the cost of increased inter-application interference which may lead to priority inversion, missed deadlines and unpredictable interactive performance. A key component to effectively manage multi-core resources is performance accounting which aims to accurately estimate interference-free application performance. Previously proposed accounting systems are either invasive or transparent. Invasive accounting systems can be accurate, but slow down latency-sensitive processes. Transparent accounting systems do not affect performance, but tend to provide less accurate performance estimates. We propose a novel class of performance accounting systems that achieve both performance-transparency and superior accuracy. We call the approach dataflow accounting, and the key idea is to track dynamic dataflow properties and use these to estimate interference-free performance. Our main contribution is Graph-based Dynamic Performance (GDP) accounting. GDP dynamically builds a dataflow graph of load requests and periods where the processor commits instructions. This graph concisely represents the relationship between memory loads and forward progress in program execution. More specifically, GDP estimates interference-free stall cycles by multiplying the critical path length of the dataflow graph with the estimated interference-free memory latency. GDP is very accurate with mean IPC estimation errors of 3.4% and 9.8% for our 4- and 8-core processors, respectively. When GDP is used in a cache partitioning policy, we observe average system throughput improvements of 11.9% and 20.8% compared to partitioning using the state-of-the-art Application Slowdown Model.","2378-203X","978-1-5386-3659-6","10.1109/HPCA.2018.00034","","https://ieeexplore.ieee.org/stamp/stamp.jsp?arnumber=8327017","Multi-core memory systems;Accounting","Economic indicators;Interference;Program processors;Load modeling;Resource management;Throughput;System performance","","14","","66","IEEE","29 Mar 2018","","","IEEE","IEEE Conferences"
"Crash Consistency in Encrypted Non-volatile Main Memory Systems","S. Liu; A. Kolli; J. Ren; S. Khan",University of Virginia; Pennsylvania State University; Microsoft Research; University of Virginia,2018 IEEE International Symposium on High Performance Computer Architecture (HPCA),"29 Mar 2018","2018","","","310","323","Non-Volatile Main Memory (NVMM) systems provide high performance by directly manipulating persistent data in-memory, but require crash consistency support to recover data in a consistent state in case of a power failure or system crash. In this work, we focus on the interplay between the crash consistency mechanisms and memory encryption. Memory encryption is necessary for these systems to protect data against the attackers with physical access to the persistent main memory. As decrypting data at every memory read access can significantly degrade the performance, prior works propose to use a memory encryption technique, counter-mode encryption, that reduces the decryption overhead by performing a memory read access in parallel with the decryption process using a counter associated with each cache line. Therefore, a pair of data and counter value is needed to correctly decrypt data after a system crash. We demonstrate that counter-mode encryption does not readily extend to crash consistent NVMM systems as the system will fail to recover data in a consistent state if the encrypted data and associated counter are not written back to memory atomically, a requirement we refer to as counter-atomicity. We show that näıvely enforcing counter-atomicity for all NVMM writes can serialize memory accesses and results in a significant performance degradation. In order to improve the performance, we make an observation that not all writes to NVMM need to be counter-atomic. The crash consistency mechanisms rely on versioning to keep one consistent copy of data intact while manipulating another version directly in-memory. As the recovery process only relies on the unmodified consistent version, it is not necessary to strictly enforce counter-atomicity for the writes that do not affect data recovery. Based on this insight, we propose selective counter-atomicity that allows reordering of writes to data and associated counters when the writes to persistent memory do not alter the recoverable consistent state. We propose efficient software and hardware support to enforce selective counter-atomicity. Our evaluation demonstrates that in a 1/2/4/8- core system, selective counter-atomicity improves performance by 6/11/22/40% compared to a system that enforces counter-atomicity for all NVMM writes. The performance of our selective counter-atomicity design comes within 5% of an ideal NVMM system that provides crash consistency of encrypted data at no cost.","2378-203X","978-1-5386-3659-6","10.1109/HPCA.2018.00035","","https://ieeexplore.ieee.org/stamp/stamp.jsp?arnumber=8327018","","Nonvolatile memory;Computer crashes;Encryption;Memory management;Hardware;Optimization","","64","","65","IEEE","29 Mar 2018","","","IEEE","IEEE Conferences"
"Adaptive Memory Fusion: Towards Transparent, Agile Integration of Persistent Memory","D. Xue; C. Li; L. Huang; C. Wu; T. Li","Department of Computer Science and Engineering, Shanghai Jiao Tong University; Department of Computer Science and Engineering, Shanghai Jiao Tong University; Department of Computer Science and Engineering, Shanghai Jiao Tong University; Department of Computer Science and Engineering, Shanghai Jiao Tong University; Intel Asia Pacific R&D Co. LTD",2018 IEEE International Symposium on High Performance Computer Architecture (HPCA),"29 Mar 2018","2018","","","324","335","The great promise of in-memory computing inspires engineers to scale their main memory subsystems in a timely and efficient manner. Offering greatly expanded capacity at near-DRAM speed, today's new-generation persistent memory (PM) module is no doubt an ideal candidate for system upgrade. However, integrating DRAM-comparable PMs in current enterprise systems faces big barriers in terms of huge system modifications for software compatibility and complex runtime support. In addition, the very large PM capacity unavoidably results in massive metadata, which introduces significant performance and energy overhead. The inefficiency issue becomes even acute when the memory system reaches its capacity limit or the application requires large memory space allocation. In this paper we propose adaptive memory fusion (AMF), a novel PM integration scheme that jointly solves the above issues. Rather than struggle to adapt to the persistence property of PM through modifying the full software stack, we focus on exploiting the high capacity feature of emerging PM modules. AMF is designed to be totally transparent to user applications by carefully hiding PM devices and managing the available PM space in a DRAM-like way. To further improve the performance, we devise holistic optimization scheme that allows the system to efficiently utilize system resources. Specifically, AMF is able to adaptively release PM based on memory pressure status, smartly reclaim PM pages, and enable fast space expansion with direct PM pass-through. We implement AMF as a kernel subsystem in Linux. Compared to traditional approaches, AMF could decrease the page faults number of high-resident-set benchmarks by up to 67.8% with an average of 46.1%. Using realistic in-memory database, we show that AMF outperforms existing solutions by 57.7% on SQLite and 21.8% on Redis. Overall, AMF represents a more lightweight design approach and it would greatly encourage rapid and flexible adoption of PM in the near future.","2378-203X","978-1-5386-3659-6","10.1109/HPCA.2018.00036","","https://ieeexplore.ieee.org/stamp/stamp.jsp?arnumber=8327019","Persistent Memory;In Memory Computing;DRAM;Adaptive;Integration","Random access memory;Memory management;Kernel;Databases;Metadata","","7","","47","IEEE","29 Mar 2018","","","IEEE","IEEE Conferences"
"Steal but No Force: Efficient Hardware Undo+Redo Logging for Persistent Memory Systems","M. A. Ogleari; E. L. Miller; J. Zhao","Univ. of California, Santa Cruz, Santa Cruz, CA, USA; Univ. of California, Santa Cruz, Santa Cruz, CA, USA; Univ. of California, Santa Cruz, Santa Cruz, CA, USA",2018 IEEE International Symposium on High Performance Computer Architecture (HPCA),"29 Mar 2018","2018","","","336","349","Persistent memory is a new tier of memory that functions as a hybrid of traditional storage systems and main memory. It combines the benefits of both: the data persistence of storage with the fast load/store interface of memory. Most previous persistent memory designs place careful control over the order of writes arriving at persistent memory. This can prevent caches and memory controllers from optimizing system performance through write coalescing and reordering. We identify that such write-order control can be relaxed by employing undo+redo logging for data in persistent memory systems. However, traditional software logging mechanisms are expensive to adopt in persistent memory due to performance and energy overheads. Previously proposed hardware logging schemes are inefficient and do not fully address the issues in software. To address these challenges, we propose a hardware undo+redo logging scheme which maintains data persistence by leveraging the write-back, write-allocate policies used in commodity caches. Furthermore, we develop a cache force-write-back mechanism in hardware to significantly reduce the performance and energy overheads from forcing data into persistent memory. Our evaluation across persistent memory microbenchmarks and real workloads demonstrates that our design significantly improves system throughput and reduces both dynamic energy and memory traffic. It also provides strong consistency guarantees compared to software approaches.","2378-203X","978-1-5386-3659-6","10.1109/HPCA.2018.00037","","https://ieeexplore.ieee.org/stamp/stamp.jsp?arnumber=8327020","NVM;persistent;memory;NVRAM;non volatile;nonvolatile;logging;hardware;architecture;microarchitecture;PRAM;efficient","Random access memory;Nonvolatile memory;Hardware;Program processors;Force;Control systems","","43","","54","IEEE","29 Mar 2018","","","IEEE","IEEE Conferences"
"Enabling Fine-Grain Restricted Coset Coding Through Word-Level Compression for PCM","S. Seyedzadeh; A. Jones; R. Melhem","Computer Science Department, University of Pittsburgh; Electrical and Computer Engineering Department, University of Pittsburgh; Computer Science Department, University of Pittsburgh",2018 IEEE International Symposium on High Performance Computer Architecture (HPCA),"29 Mar 2018","2018","","","350","361","Phase change memory (PCM) has recently emerged as a promising technology to meet the fast growing demand for large capacity memory in computer systems, replacing DRAM that is impeded by physical limitations. Multi-level cell (MLC) PCM offers high density with low per-byte fabrication cost. However, despite many advantages, such as scalability and low leakage, the energy for programming intermediate states is considerably larger than programming single-level cell PCM. In this paper, we study encoding techniques to reduce write energy for MLC PCM when the encoding granularity is lowered below the typical cache line size. We observe that encoding data blocks at small granularity to reduce write energy actually increases the write energy because of the auxiliary encoding bits. We mitigate this adverse effect by 1) designing suitable codeword mappings that use fewer auxiliary bits and 2) proposing a new Word-Level Compression (WLC) which compresses more than 91% of the memory lines and provides enough room to store the auxiliary data using a novel restricted coset encoding applied at small data block granularities. Experimental results show that the proposed encoding at 16-bit data granularity reduces the write energy by 39%, on average, versus the leading encoding approach for write energy reduction. Furthermore, it improves endurance by 20% and is more reliable than the leading approach. Hardware synthesis evaluation shows that the proposed encoding can be implemented on-chip with only a nominal area overhead.","2378-203X","978-1-5386-3659-6","10.1109/HPCA.2018.00038","","https://ieeexplore.ieee.org/stamp/stamp.jsp?arnumber=8327021","PCM;Word Level Compression;Coset Coding","Encoding;Phase change materials;Computer architecture;Microprocessors;Programming;Resistance;Energy states","","12","","37","IEEE","29 Mar 2018","","","IEEE","IEEE Conferences"
"Perception-Oriented 3D Rendering Approximation for Modern Graphics Processors","C. Xie; X. Fu; S. Song","ECE Department, University of Houston; ECE Department, University of Houston; High Performance Computing Group, Pacific Northwest National Lab (PNNL)",2018 IEEE International Symposium on High Performance Computer Architecture (HPCA),"29 Mar 2018","2018","","","362","374","Anisotropic filtering enabled by modern rasterization-based GPUs provides users with extremely authentic visualization experience, but significantly limits the performance and energy efficiency of 3D rendering process due to its large texture data requirement. To improve 3D rendering efficiency, we build a bridge between anisotropic filtering process and human visual system by analyzing users’ perception on image quality. We discover that anisotropic filtering does not impact user perceived image quality on every pixel. This motives us to approximate the anisotropic filtering process for non-perceivable pixels in order to improve the overall 3D rendering performance without damaging user experience. To achieve this goal, we propose a perceptionoriented runtime approximation model for 3D rendering by leveraging the inner-relationship between anisotropic and isotropic filtering. We also provide a low-cost texture unit design for enabling this approximation. Extensive evaluation on modern 3D games demonstrates that, under a conservative tuning point, our design achieves a significant average speedup of 17% for the overall 3D rendering along with 11% total GPU energy reduction, without visible image quality loss from users’ perception. It also reduces the texture filtering latency by an average of 29%. Additionally, it creates a unique perception-based tuning space for performance-quality tradeoffs on graphics processors.","2378-203X","978-1-5386-3659-6","10.1109/HPCA.2018.00039","","https://ieeexplore.ieee.org/stamp/stamp.jsp?arnumber=8327022","GPU;Approximate Computing;3D Rendering;User-Oriented Study","Three-dimensional displays;Rendering (computer graphics);Image quality;Image color analysis;Computer architecture;Runtime;Graphics processing units","","10","","49","IEEE","29 Mar 2018","","","IEEE","IEEE Conferences"
"Warp Scheduling for Fine-Grained Synchronization","A. ElTantawy; T. M. Aamodt","The University of British Columbia Faculty of Medicine, Vancouver, BC, CA; University of British Columbia, Canada",2018 IEEE International Symposium on High Performance Computer Architecture (HPCA),"29 Mar 2018","2018","","","375","388","Fine-grained synchronization is employed in many parallel algorithms and is often implemented using busy-wait synchronization (e.g., spin locks). However, busy-wait synchronization incurs significant overheads and existing CPU solutions do not readily translate to single-instruction, multiple-thread (SIMT) graphics processor unit (GPU) architectures. In this paper, we propose Back-Off Warp Spinning (BOWS), a hardware warp scheduling policy that extends existing warp scheduling policies to temporarily deprioritize warps executing busy wait code. In addition, we propose Dynamic Detection of Spinning (DDOS), a novel hardware mechanism for accurately and efficiently detecting busy-wait synchronization on GPUs. On a set of GPU kernels employing busy-wait synchronization, DDOS identifies all busy-wait loops incurring no false detections. BOWS improves performance by 1.5× and reduces energy consumption by 1.6× versus Criticality-Aware Warp Acceleration (CAWA) [14].,,,,","2378-203X","978-1-5386-3659-6","10.1109/HPCA.2018.00040","","https://ieeexplore.ieee.org/stamp/stamp.jsp?arnumber=8327023","Warp Scheduling;Synchronization;SIMT Architectures;Busy Wait;GPGPUs","Synchronization;Delays;Graphics processing units;Spinning;Computer architecture;Hardware;Processor scheduling","","26","","37","IEEE","29 Mar 2018","","","IEEE","IEEE Conferences"
"WIR: Warp Instruction Reuse to Minimize Repeated Computations in GPUs","K. Kim; W. W. Ro","School of Electrical and Electronic Engineering, Yonsei University, Seoul, Korea; School of Electrical and Electronic Engineering, Yonsei University, Seoul, Korea",2018 IEEE International Symposium on High Performance Computer Architecture (HPCA),"29 Mar 2018","2018","","","389","402","Warp instructions with an identical arithmetic operation on same input values produce the identical computation results. This paper proposes warp instruction reuse to allow such repeated warp instructions to reuse previous computation results instead of actually executing the instructions. Bypassing register reading, functional unit, and register writing operations improves energy efficiency. This reuse technique is especially beneficial for GPUs since a GPU warp register is usually as wide as thousands of bits. In addition, we propose warp register reuse which allows identical warp register values to share a single physical register through register renaming. The register reuse technique enables to see if different logical warp registers have an identical value by only looking at their physical warp register IDs. Based on this observation, warp register reuse helps to perform all necessary operations for warp instruction reuse with register IDs, which is substantially more efficient than directly manipulating register values. Performance evaluation shows that 20.5% SM energy and 10.7% GPU energy can be saved by allowing 18.7% of warp instructions to reuse prior results.","2378-203X","978-1-5386-3659-6","10.1109/HPCA.2018.00041","","https://ieeexplore.ieee.org/stamp/stamp.jsp?arnumber=8327024","GPU;microarchitecture;instruction reuse;register renaming","Registers;Instruction sets;Graphics processing units;Pipelines;Microarchitecture;Benchmark testing;Resource management","","17","","66","IEEE","29 Mar 2018","","","IEEE","IEEE Conferences"
"G-TSC: Timestamp Based Coherence for GPUs","A. Tabbakh; X. Qian; M. Annavaram","Electrical Engineering Dept., University of Southern California, Los Angeles, USA; Electrical Engineering Dept., University of Southern California, Los Angeles, USA; Electrical Engineering Dept., University of Southern California, Los Angeles, USA",2018 IEEE International Symposium on High Performance Computer Architecture (HPCA),"29 Mar 2018","2018","","","403","415","Cache coherence has been studied extensively in the context of chip multiprocessors (CMP). It is well known that conventional directory-based and snooping coherence protocols generate considerable coherence traffic as the number of hardware thread contexts increase. Since GPUs support hundreds or even thousands of threads, conventional coherence mechanisms when applied to GPUs will exacerbate the the bandwidth constraints that GPUs already face. Recognizing this constraint, prior work has proposed time-based coherence protocols. The main idea is to assign a lease period to the accessed cache block, and after the lease expires the cache block is self-invalidated. However, time-based coherence protocols require global synchronized clocks. Furthermore, this approach may increase execution stalls since threads have to wait to access data with an unexpired lease. Tardis is timestamp-based coherence protocol that has been proposed recently to alleviate the need for global clocks in CPUs. This paper builds on this prior work and proposes G-TSC, a novel cache coherence protocol for GPUs that is based on timestamp ordering. G-TSC conducts its coherence transactions in logical time. This work demonstrates the challenges in adopting timestamp coherence for GPUs which support massive thread parallelism and have unique microarchitecture features. This work then presents a number of solutions that tackle GPU-centric challenges. Evaluation of G-TSC implemented in the GPGPU-Sim simulation framework shows that G-TSC outperforms time-based coherence by 38% with release consistency.","2378-203X","978-1-5386-3659-6","10.1109/HPCA.2018.00042","","https://ieeexplore.ieee.org/stamp/stamp.jsp?arnumber=8327025","GPU;cache coherence","Coherence;Protocols;Instruction sets;Graphics processing units;Clocks;Synchronization;Hardware","","9","","37","IEEE","29 Mar 2018","","","IEEE","IEEE Conferences"
